{
  "schemaVersion": "qcm-parity-1",
  "legacyBase": "f7783944387202bcafaeb7ff3f67789098fa6a4e",
  "command": "apply-canonical",
  "source": {
    "name": "profile-headerless.csv",
    "sha256": "f63230e49d66c522a0d830400284d535a0e0c22be6eec3f5de8a55bd503b4ff6",
    "kind": "csv"
  },
  "operations": [
    {
      "index": 0,
      "op": "set_cell",
      "applied": true
    },
    {
      "index": 1,
      "op": "set_output",
      "applied": false
    },
    {
      "index": 2,
      "op": "set_output",
      "applied": true
    },
    {
      "index": 3,
      "op": "normalize",
      "applied": true
    },
    {
      "index": 4,
      "op": "undo",
      "applied": true
    },
    {
      "index": 5,
      "op": "undo",
      "applied": true
    },
    {
      "index": 6,
      "op": "undo",
      "applied": true
    },
    {
      "index": 7,
      "op": "undo",
      "applied": false
    }
  ],
  "snapshot": {
    "rawGrid": [
      [
        "Profile Name",
        "",
        "Mode 1"
      ],
      [
        "config.csv"
      ],
      [
        "PlayStation Outputs",
        "Function",
        "usb"
      ],
      [
        "triangle",
        "normal",
        "lip"
      ]
    ],
    "document": {
      "csvFileName": "config.csv",
      "fileNameCellRow": 2,
      "hasVersionHeader": false,
      "headerVersion": "",
      "headerSource": "",
      "headerName": "",
      "title": "Mode 1",
      "isDefaultConfig": false,
      "isDevicePreferences": false,
      "sheets": [
        {
          "index": 0,
          "type": "ProfileName",
          "modeName": "Mode 1",
          "csvFileName": "config.csv",
          "headerLabel": "PlayStation Outputs",
          "channel": "usb",
          "startRow": 1,
          "bindings": [
            {
              "row": 4,
              "output": "triangle",
              "function": "normal",
              "inputs": [
                "lip"
              ],
              "inputCols": [
                2
              ],
              "actionName": ""
            }
          ]
        }
      ]
    },
    "issues": [],
    "editor": {
      "dirty": true,
      "revision": 6,
      "canUndo": false
    },
    "serialized": {
      "sha256": "f63230e49d66c522a0d830400284d535a0e0c22be6eec3f5de8a55bd503b4ff6",
      "utf8Bytes": 89,
      "text": "Profile Name,,Mode 1\r\nconfig.csv\r\nPlayStation Outputs,Function,usb\r\ntriangle,normal,lip\r\n"
    }
  }
}
