{
  "schemaVersion": "qcm-parity-1",
  "legacyBase": "f7783944387202bcafaeb7ff3f67789098fa6a4e",
  "command": "firmware-canonical",
  "source": {
    "name": "single-tab.xlsx",
    "sha256": "611380dfb5a42d168e3b154cfe113dd11118bd6110e61462e0f80d0c9f0d8e27",
    "kind": "xlsx"
  },
  "modes": [],
  "serialized": {
    "sha256": "5130032a72b452d1406b348797cb826a94c980f828ce776e9f894008be5c2249",
    "utf8Bytes": 2200,
    "text": "Profile Name,,Keyboard \u0026 Mouse,,,,,,,,Comment\r\ndiv2.csv,,Normal\r\nOutput or Function,Function,usb\r\nkb_i,tap 150,right_puff,,,,,,,,inventory\r\nkb_v,delay_on 250,right_puff,,,,,,,,heal\r\nkb_c,toggle,right_sip,,,,,,,,push to talk\r\nkb_w,toggle,mp_left_center_puff,,,,,,,,forward\r\nkb_s,toggle,mp_left_center_sip,,,,,,,,backward\r\nkb_left_shift,toggle,mp_right_sip,,,,,,,,Sprint\r\nkb_w,force_off,mp_left_center_sip,,,,,,,,force off backwards\r\nkb_s,force_off,mp_left_center_puff,,,,,,,,force off forward\r\nkb_a,normal,digital_in_1,,,,,,,,left\r\nkb_d,normal,digital_in_8,,,,,,,,right\r\nkb_left_control,tap 150,mp_right_puff,,,,,,,,Jump/climb\r\nkb_space,normal,digital_in_7,,,,,,,,Cover\u00A0/ click\r\nkb_space,normal,lip,,,,,,,,Cover\u00A0/ click\r\nkb_space,normal,lip,,,,,,,,change Cover / hold click\r\nkb_space,normal,lip,,,,,,,,roll / Double click\r\nkb_f,normal,mp_left_puff,,,,,,,,interact\r\nmouse_wheel_up,tap 150,mp_right_center_puff,,,,,,,,change weapon up\r\nmouse_wheel_down,tap 150,mp_right_center_sip,,,,,,,,change weapon down\r\nmouse_right_button,toggle,mp_center_sip,,,,,,,,aim\r\nmouse_left_button,normal,mp_center_puff,,,,,,,,shoot\r\nmouse_left,normal,left,,,,,,,,look around\r\nmouse_right,normal,right\r\nmouse_up,normal,up\r\nmouse_down,normal,down\r\nkb_g,delay_on 180,mp_right_puff,,,,,,,,throw grenade\r\nkb_m,tap 200,mp_left_sip,,,,,,,,map\r\nkb_escape,delay_on 201,mp_left_sip,,,,,,,,main menu\r\nkb_q,delay_on 200,mp_right_center_puff,,,,,,,,turret/shield etc\r\nkb_e,delay_on 200,mp_right_center_sip,,,,,,,,smart grenade\r\njoystick_deflection_maximum,normal,45,,,,,,,,joystick sensivity\r\njoystick_deflection_minimum,normal,3\r\ndeflection_multiplier_up,normal,85\r\ndeflection_multiplier_down,normal,85\r\ndeflection_multiplier_left,normal,85\r\ndeflection_multiplier_right,normal,85\r\nkb_x,normal,mp_left_sip_soft,,,,,,,,travel\r\nkb_h,delay_off 6000,mp_right_sip_soft,,,,,,,,emotions\r\nkb_r,normal,mp_center_sip_soft,,,,,,,,reload\r\nkb_t,normal,mp_center_puff_soft,,,,,,,,melee / zoom\r\nmouse_speed,normal,110\r\nkb_q,normal,mp_right_center_puff_soft,,,,,,,,lock target for skill\r\nkb_e,normal,mp_right_center_sip_soft,,,,,,,,lock target for skill\r\nkb_q,force_off,mp_center_puff\r\nkb_left_control,normal,mp_left_puff_soft,,,,,,,,kill yourself\r\n"
  }
}
