{
  "schemaVersion": "qcm-parity-1",
  "legacyBase": "f7783944387202bcafaeb7ff3f67789098fa6a4e",
  "command": "normalize-canonical",
  "source": {
    "name": "profile-extra-columns.csv",
    "sha256": "f549e0f4f122021b8c492ea5e61cb1deff42709ba6a54c8c9c4ba14739887af0",
    "kind": "csv"
  },
  "import": null,
  "snapshot": {
    "rawGrid": [
      [
        "QuadStick Configuration",
        "Version 1.5",
        "",
        "Extra Columns"
      ],
      [
        "Profile Name",
        "",
        "Mode 1"
      ],
      [
        "extra.csv"
      ],
      [
        "PlayStation Outputs",
        "Function",
        "usb",
        "",
        "",
        "",
        "",
        "",
        "",
        "",
        "",
        "Note",
        "Action",
        "Opaque"
      ],
      [
        "mouse_left",
        "normal",
        "lip",
        "",
        "",
        "",
        "",
        "",
        "",
        "",
        "",
        "keep me",
        "Shoot",
        "do-not-drop"
      ]
    ],
    "document": {
      "csvFileName": "extra.csv",
      "fileNameCellRow": 3,
      "hasVersionHeader": true,
      "headerVersion": "Version 1.5",
      "headerSource": "",
      "headerName": "Extra Columns",
      "title": "Extra Columns",
      "isDefaultConfig": false,
      "isDevicePreferences": false,
      "sheets": [
        {
          "index": 0,
          "type": "ProfileName",
          "modeName": "Mode 1",
          "csvFileName": "extra.csv",
          "headerLabel": "PlayStation Outputs",
          "channel": "usb",
          "startRow": 2,
          "bindings": [
            {
              "row": 5,
              "output": "mouse_left",
              "function": "normal",
              "inputs": [
                "lip"
              ],
              "inputCols": [
                2
              ],
              "actionName": "keep me"
            }
          ]
        }
      ]
    },
    "issues": [],
    "editor": {
      "dirty": false,
      "revision": 0,
      "canUndo": false
    },
    "serialized": {
      "sha256": "f549e0f4f122021b8c492ea5e61cb1deff42709ba6a54c8c9c4ba14739887af0",
      "utf8Bytes": 203,
      "text": "QuadStick Configuration,Version 1.5,,Extra Columns\r\nProfile Name,,Mode 1\r\nextra.csv\r\nPlayStation Outputs,Function,usb,,,,,,,,,Note,Action,Opaque\r\nmouse_left,normal,lip,,,,,,,,,keep me,Shoot,do-not-drop\r\n"
    }
  }
}
