{
  "schemaVersion": "qcm-parity-1",
  "legacyBase": "f7783944387202bcafaeb7ff3f67789098fa6a4e",
  "command": "normalize-canonical",
  "source": {
    "name": "csv-empty.csv",
    "sha256": "e3b0c44298fc1c149afbf4c8996fb92427ae41e4649b934ca495991b7852b855",
    "kind": "csv"
  },
  "import": null,
  "snapshot": {
    "rawGrid": [
      [
        "QuadStick Configuration",
        "Version 1.5",
        "",
        "config"
      ]
    ],
    "document": {
      "csvFileName": null,
      "fileNameCellRow": 2,
      "hasVersionHeader": true,
      "headerVersion": "Version 1.5",
      "headerSource": "",
      "headerName": "config",
      "title": "config",
      "isDefaultConfig": false,
      "isDevicePreferences": false,
      "sheets": []
    },
    "issues": [
      {
        "severity": "Error",
        "cell": "A1",
        "kind": "None",
        "message": "First cell must contain \u0022Profile\u0022 or be \u0022Preferences\u0022 or \u0022Infrared\u0022. Found \u0022\u0022.",
        "fix": "Set cell A1 to the sheet type keyword, e.g. \u0022Profile Name\u0022."
      },
      {
        "severity": "Error",
        "cell": "A2",
        "kind": "None",
        "message": "The cell under the first sheet\u0027s keyword must contain the CSV filename.",
        "fix": "Set it to a name like \u0022mygame.csv\u0022."
      }
    ],
    "editor": {
      "dirty": true,
      "revision": 1,
      "canUndo": true
    },
    "serialized": {
      "sha256": "8c927df94204b09679c37c70afa5d077b62bbd6ab172b65bfb3c56a8151db040",
      "utf8Bytes": 45,
      "text": "QuadStick Configuration,Version 1.5,,config\r\n"
    }
  }
}
