{
  "schemaVersion": "qcm-parity-1",
  "legacyBase": "f7783944387202bcafaeb7ff3f67789098fa6a4e",
  "command": "firmware-canonical",
  "source": {
    "name": "multi-tab.xlsx",
    "sha256": "eb590cfa243d6a908ab70ac74b511fed663c7295cd8effcf804b074e422c8362",
    "kind": "xlsx"
  },
  "modes": [],
  "serialized": {
    "sha256": "3f045ac2e4f828ee8bdd8d0a2fb01d79fd220c879f8e164c25ecbba02140d0a5",
    "utf8Bytes": 7909,
    "text": "Profile Name,,Main,,,,,,,,Pan Mode\r\nnomanssky.csv,,Normal,,,,,,,,Alternate\r\nOutput or Function,Function,usb,,,,,,,,usb\r\nkb_w,force_off,right_puff\r\nkb_f,force_off,right_puff\r\nkb_left_shift,force_off,right_puff,,,,,,,,,,,,,,,,Sprint\r\nkb_left_alt,force_off,right_puff\r\nincrement_mode,normal,mp_left_right_puff,,,,,,,,Basic mouse only configuration for PC users,,,,,,,,skip to mouse mode\r\nincrement_mode,normal,mp_left_right_puff,,,,,,,,Basic mouse only configuration for PC users\r\nincrement_mode,delay_on 500,right_sip_soft,,,,,,,,Basic mouse only configuration for PC users\r\ndecrement_mode,delay_on 500,right_puff_soft\r\nkb_grave_accent_and_tilde,force_off,right_puff\r\nkb_a,greater_than 8,left,,,,,,,,,,,,,,,,Left\r\nmouse_up,greater_than 90,up,,,,,,,,,,,,,,,,Camera Adjust (Right Stick)\r\nkb_d,greater_than 8,right,,,,,,,,,,,,,,,,Right\r\nmouse_down,greater_than 90,down,,,,,,,,,,,,,,,,Camera Adjust (Right Stick)\r\nkb_w,greater_than 8,up,,,,,,,,,,,,,,,,Up\r\nmouse_left,greater_than 90,left,,,,,,,,,,,,,,,,Camera Adjust (Right Stick)\r\nkb_s,greater_than 8,down,,,,,,,,,,,,,,,,Down\r\nkb_w,force_off,down\r\nkb_left_shift,force_off,down\r\nmouse_right,greater_than 90,right,,,,,,,,,,,,,,,,Camera Adjust (Right Stick)\r\nkb_w,delayed_latch 50,lip,,,,,,,,,,,,,,,,Auto forward\r\nkb_space,normal,mp_center_sip,,,,,,,,,,,,,,,,swim up/Jump/climb with jet pack\r\nkb_q,normal,mp_center_sip_soft,,,,,,,,,,,,,,,,swim down/melee\r\nkb_e,normal,mp_left_puff,,,,,,,,,,,,,,,,interact\r\nkb_g,normal,mp_right_puff_soft,,,,,,,,,,,,,,,,Terrain manipulation\r\nkb_c,normal,mp_left_sip,,,,,,,,,,,,,,,,scan\r\nkb_t,normal,mp_left_puff_soft,,,,,,,,,,,,,,,,activate torch\r\nkb_f,delayed_latch 50,mp_right_sip,,,,,,,,,,,,,,,,activate zoom/Analyzer Goggles \r\nkb_z,normal,mp_left_center_sip,,,,,,,,,,,,,,,,Build\r\nkb_tab,normal,mp_left_sip_soft,,,,,,,,,,,,,,,,Repair/inventory\r\nkb_p,normal,mp_left_right_sip_soft,,,,,,,,,,,,,,,,Information \r\nkb_left_control,normal,mp_right_center_sip_soft\r\nkb_left_alt,delayed_latch 50,mp_right_center_sip,,,,,,,,,,,,,,,,Scale/rotate\r\nmouse_right_button,normal,mp_right_sip_soft,,,,,,,,,,,,,,,,Show HUD/increase zoom\r\nkb_left_shift,delayed_latch 150,mp_left_center_puff,,,,,,,,,,,,,,,,Sprint\r\nmouse_left_button,normal,mp_center_puff,,,,,,,,,,,,,,,,fire weapon\r\nmouse_middle_button,normal,mp_right_puff,,,,,,,,,,,,,,,,fire grenade\r\nmouse_wheel_up,normal,mp_left_center_sip_soft\r\nmouse_wheel_down,normal,mp_left_center_puff_soft\r\nkb_r,normal,mp_triple_sip,,,,,,,,,,,,,,,,reload weapon\r\nkb_x,delayed_latch 500,mp_center_puff_soft,,,,,,,,,,,,,,,,change weapon mode\r\nkb_semicolon,pulse 1 1,mp_right_center_puff,,,,,,,,,,,,,,,,Activate Interactor\r\nkb_escape,normal,mp_triple_sip_soft,,,,,,,,,,,,,,,,Menu\r\nkb_grave_accent_and_tilde,delayed_latch 50,right_sip,,,,,,,,,,,,,,,,Voice chat\r\nkb_right_alt,normal,mp_triple_puff_soft,,,,,,,,Switch screens\r\nkb_tab,normal,mp_triple_puff_soft\r\nkb_left_control,delayed_latch 300,mp_triple_puff,,,,,,,,Click at gaze point,,,,,,,,Click at gaze point\r\nkb_left_shift,delayed_latch 300,mp_triple_puff\r\nkb_f7,delayed_latch 300,mp_triple_puff\r\n\r\nProfile Name,,Flight,,,,,,,,Pan Mode\r\nnomanssky.csv,,Normal,,,,,,,,Alternate\r\nOutput or Function,Function,usb,,,,,,,,usb\r\nkb_left_shift,force_off,right_puff\r\nkb_w,force_off,right_puff\r\nincrement_mode,normal,mp_left_right_puff,,,,,,,,Basic mouse only configuration for PC users,,,,,,,,skip to mouse mode\r\nincrement_mode,delay_on 500,right_sip_soft,,,,,,,,Basic mouse only configuration for PC users\r\ndecrement_mode,delay_on 500,right_puff_soft\r\nkb_grave_accent_and_tilde,force_off,right_puff\r\nkb_a,normal,mp_left_sip,,,,,,,,,,,,,,,,Roll left\r\nmouse_up,greater_than 8,up,,,,,,,,,,,,,,,,Camera Adjust (Right Stick)\r\nkb_d,normal,mp_left_puff,,,,,,,,,,,,,,,,Roll right\r\nmouse_down,greater_than 8,down,,,,,,,,,,,,,,,,Camera Adjust (Right Stick)\r\nkb_w,normal,mp_center_puff,,,,,,,,,,,,,,,,Thrust\r\nmouse_left,greater_than 8,left,,,,,,,,,,,,,,,,Camera Adjust (Right Stick)\r\nkb_s,normal,mp_center_sip,,,,,,,,,,,,,,,,Brake\r\nmouse_right,greater_than 8,right,,,,,,,,,,,,,,,,Camera Adjust (Right Stick)\r\nkb_w,delayed_latch 200,mp_right_center_sip,,,,,,,,,,,,,,,,Auto forward\r\nkb_left_shift,delayed_latch 200,mp_left_puff_soft,,,,,,,,,,,,,,,,Boost\r\nkb_e,normal,mp_right_sip,,,,,,,,,,,,,,,,Exit ship\r\nkb_e,normal,mp_right_sip_soft,,,,,,,,,,,,,,,,Initiate landing\r\nmouse_left_button,normal,mp_left_center_puff,,,,,,,,,,,,,,,,Fire weapons\r\nkb_x,normal,mp_triple_sip,,,,,,,,,,,,,,,,change weapon mode\r\nkb_c,normal,mp_right_puff,,,,,,,,,,,,,,,,scan\r\nkb_space,normal,lip,,,,,,,,,,,,,,,,pulse engine\r\nkb_m,normal,mp_center_puff_soft,,,,,,,,,,,,,,,,Galactic map\r\nkb_semicolon,pulse 1 1,mp_right_center_puff,,,,,,,,,,,,,,,,Activate Interactor\r\nkb_escape,normal,mp_triple_sip_soft,,,,,,,,,,,,,,,,Menu\r\nkb_grave_accent_and_tilde,delayed_latch 50,right_sip,,,,,,,,,,,,,,,,Voice chat\r\nkb_right_alt,normal,mp_triple_puff_soft,,,,,,,,Switch screens\r\nkb_tab,normal,mp_triple_puff_soft\r\nkb_left_control,delayed_latch 300,mp_left_center_sip,,,,,,,,Click at gaze point,,,,,,,,Click at gaze point\r\nkb_left_shift,delayed_latch 300,mp_left_center_sip\r\nkb_f7,delayed_latch 300,mp_left_center_sip\r\n\r\nProfile Name,,Mouse,,,,,,,,Comments\r\nfairytail.csv,,Normal\r\nOutput or Function,Function,usb\r\nincrement_mode,delay_on 500,right_sip_soft,,,,,,,,Basic mouse only configuration for PC users\r\ndecrement_mode,delay_on 500,right_puff_soft\r\nkb_grave_accent_and_tilde,force_off,right_puff\r\nkb_left_control,force_off,right_puff\r\nkb_left_shift,force_off,right_puff\r\nkb_left_alt,force_off,right_puff\r\nkb_keypad_0,delay_on 200,right_puff,,,,,,,,,,,,,,,,Play\r\nkb_keypad_1,delay_on 200,mp_left_center_sip_soft,,,,,,,,,,,,,,,,Instant replay\r\nkb_keypad_3,delay_on 200,mp_left_center_puff_soft,,,,,,,,,,,,,,,,Fast-forward\r\nkb_left_shift,delay_on 200,mp_right_sip_soft,,,,,,,,,,,,,,,,Cycle between Japanese and English\r\nkb_left_alt,delay_on 200,mp_right_sip_soft\r\ndigital_out1_toggle,delay_on 200,mp_right_sip_soft\r\nkb_left_control,normal,mp_left_right_sip,,,,,,,,,,,,,,,,hiragana\r\nkb_caps_lock,normal,mp_left_right_sip\r\nkb_left_alt,normal,mp_left_right_puff,,,,,,,,,,,,,,,,katakana\r\nkb_caps_lock,normal,mp_left_right_puff\r\nmouse_left,normal,left\r\nmouse_right,normal,right\r\nmouse_up,normal,up\r\nmouse_down,normal,down\r\nmouse_wheel_down,normal,mp_right_puff\r\nmouse_wheel_up,normal,mp_right_sip\r\nmouse_left_button,delayed_latch 1000,mp_center_puff\r\nmouse_right_button,normal,mp_center_sip\r\nmouse_middle_button,normal,mp_right_puff_soft\r\nkb_enter,normal,lip\r\nkb_escape,normal,mp_right_center_puff_soft\r\nkb_tab,normal,mp_left_puff\r\nkb_backspace,normal,mp_left_center_sip\r\nkb_space,normal,mp_left_center_puff\r\nkb_keypad_minus,normal,mp_left_puff_soft\r\nkb_keypad_plus,normal,mp_left_sip_soft\r\nkb_left_control,normal,mp_triple_sip\r\nkb_c,normal,mp_triple_sip\r\nkb_left_control,normal,mp_triple_puff\r\nkb_v,normal,mp_triple_puff\r\nkb_right_alt,normal,mp_triple_puff_soft,,,,,,,,Switch screens\r\nkb_tab,normal,mp_triple_puff_soft\r\nkb_grave_accent_and_tilde,delayed_latch 50,right_sip,,,,,,,,,,,,,,,,Voice chat\r\nkb_left_control,delay_on 1000,mp_right_center_sip,,,,,,,,Activate eye gaze\r\nkb_left_shift,delay_on 1000,mp_right_center_sip\r\nkb_f4,delay_on 1000,mp_right_center_sip\r\nkb_left_control,delay_on 1000,mp_right_center_puff_soft,,,,,,,,Disable interactors\r\nkb_left_shift,delay_on 1000,mp_right_center_puff_soft\r\nkb_f8,delay_on 1000,mp_right_center_puff_soft\r\nkb_left_control,normal,mp_right_center_sip_soft,,,,,,,,Click at gaze point,,,,,,,,Click at gaze point\r\nkb_left_shift,normal,mp_right_center_sip_soft\r\nkb_f7,normal,mp_right_center_sip_soft\r\nkb_pause,normal,mp_right_center_puff,,,,,,,,Click interactor,,,,,,,,Activate interactor\r\nkb_left_shift,normal,mp_triple_sip_soft,,,,,,,,,,,,,,,,Mathematica enter\r\nkb_enter,normal,mp_triple_sip_soft\r\n\r\nPreferences,,,,,,,,,,Pan Mode\r\n,,,,,,,,,,Alternate\r\nPreference,Value,Units,,,,,,,,usb\r\nsip_puff_delay_soft,130,ms,Time delay before detecting Soft Sip/Puff or Inner Joystick Zone\r\n"
  }
}
